{
  "checksum": "sha256:bbbbbbbbbbbbbbbbbbbbbbbbbbbbbbbbbbbbbbbbbbbbbbbbbbbbbbbbbbbbbbbb",
  "compatibility": [{"maximum_version_exclusive": null, "minimum_version": "0.1", "required_capabilities": ["mcp.install"], "target_id": "sample-codex-mcp"}],
  "components": [{"id": "portable-mcp", "portable": true, "type": "mcp"}],
  "id": "sample-codex-mcp-package",
  "immutable_ref": "sha256:bbbbbbbbbbbbbbbbbbbbbbbbbbbbbbbbbbbbbbbbbbbbbbbbbbbbbbbbbbbbbbbb",
  "license": "MIT",
  "overlays": [],
  "publisher": "example.internal",
  "requirements": [],
  "rollback_steps": ["installer.restore"],
  "schema_version": 1,
  "scopes": ["managed_home", "project"],
  "source": "payload/server.json",
  "source_type": "raw_mcp",
  "trust_evidence": [{"authority": "sdk-sample", "id": "sample-source", "kind": "source", "revision": "v1", "status": "unverified"}],
  "update_policy": "pinned",
  "verification_steps": ["mcp.discover"],
  "version": "0.1.0"
}
