{
  "checksum": "sha256:aaaaaaaaaaaaaaaaaaaaaaaaaaaaaaaaaaaaaaaaaaaaaaaaaaaaaaaaaaaaaaaa",
  "compatibility": [],
  "components": [{"id": "portable-skill", "portable": true, "type": "skill"}],
  "id": "sample-portable-skill",
  "immutable_ref": "sha256:aaaaaaaaaaaaaaaaaaaaaaaaaaaaaaaaaaaaaaaaaaaaaaaaaaaaaaaaaaaaaaaa",
  "license": "MIT",
  "overlays": [],
  "publisher": "example.internal",
  "requirements": [],
  "rollback_steps": ["installer.restore"],
  "schema_version": 1,
  "scopes": ["managed_home", "project"],
  "source": "payload/SKILL.md",
  "source_type": "local",
  "trust_evidence": [{"authority": "sdk-sample", "id": "sample-source", "kind": "source", "revision": "v1", "status": "unverified"}],
  "update_policy": "pinned",
  "verification_steps": ["skill.parse"],
  "version": "0.1.0"
}
